{
  "$schema": "https://json-schema.org/draft/2020-12/schema",
  "$id": "https://dk-data-studio.local/schema/plugin-manifest-v1.16.json",
  "title": "DK Data Studio Plugin Manifest",
  "type": "object",
  "additionalProperties": true,
  "required": [
    "id",
    "name",
    "version",
    "apiVersion",
    "entry",
    "requiresCore"
  ],
  "properties": {
    "id": {
      "type": "string",
      "pattern": "^[A-Za-z0-9][A-Za-z0-9._-]*$"
    },
    "name": {
      "type": "string",
      "minLength": 1
    },
    "version": {
      "type": "string",
      "pattern": "^\\d+\\.\\d+\\.\\d+(?:-[0-9A-Za-z.-]+)?$"
    },
    "apiVersion": {
      "enum": [
        "1.10.0",
        "1.11.0",
        "1.12.0",
        "1.13.0",
        "1.14.0",
        "1.15.0",
        "1.16.0"
      ]
    },
    "entry": {
      "type": "string",
      "pattern": "^[^/\\\\]+\\.js$"
    },
    "enabled": {
      "type": "boolean"
    },
    "order": {
      "type": "number"
    },
    "description": {
      "type": "string"
    },
    "pluginType": {
      "enum": [
        "foundation",
        "data",
        "algorithm",
        "workbench",
        "task",
        "tool",
        "extension",
        "developer"
      ]
    },
    "requiresCore": {
      "type": "array",
      "uniqueItems": true,
      "items": {
        "enum": [
          "runtime",
          "events",
          "status",
          "io",
          "science",
          "performance",
          "services",
          "modules",
          "recipes",
          "capabilities",
          "state",
          "project",
          "workspace",
          "parameters",
          "data.flow",
          "data.reactive",
          "data.pipeline",
          "data.transforms",
          "data.artifacts",
          "data.entities",
          "data.types",
          "data.model",
          "data.formula",
          "data.sources",
          "workflow",
          "analysis.providers",
          "analysis.algorithms",
          "analysis.detectors",
          "charts",
          "charts.providers",
          "ui.dom",
          "ui.components",
          "ui.workspace",
          "ui.scientific-plot",
          "ui.plot-views",
          "ui.table",
          "ui.settings",
          "ui.actions",
          "ui.selection",
          "ui.interaction",
          "ui.interaction-behavior",
          "ui.menus",
          "ui.context-menus",
          "ui.activities",
          "ui.top-workspace",
          "ui.toolbar",
          "ui.status-bar",
          "ui.shortcuts",
          "ui.pages",
          "ui.styles",
          "ui.portable",
          "ui.edit",
          "data.importers",
          "data.import-workbench"
        ]
      }
    },
    "capabilities": {
      "type": "array",
      "uniqueItems": true,
      "items": {
        "type": "string"
      }
    },
    "workspace": {
      "type": "object",
      "properties": {
        "role": {
          "enum": [
            "top"
          ]
        },
        "activity": {
          "type": "string"
        },
        "icon": {
          "type": "string"
        },
        "title": {
          "type": "string"
        },
        "defaultSuper": {
          "type": "boolean"
        }
      }
    },
    "window": {
      "type": "object",
      "required": [
        "activity"
      ],
      "properties": {
        "activity": {
          "type": "string"
        },
        "title": {
          "type": "string"
        },
        "runtime": {
          "type": "string"
        },
        "scripts": {
          "type": "array",
          "items": {
            "type": "string"
          }
        },
        "dependencies": {
          "type": "array",
          "items": {
            "type": "string"
          }
        },
        "prewarm": {
          "type": "boolean"
        },
        "reuse": {
          "type": "boolean"
        },
        "persistence": {
          "enum": [
            "project",
            "memory",
            "none"
          ]
        },
        "width": {
          "type": "number",
          "exclusiveMinimum": 0
        },
        "height": {
          "type": "number",
          "exclusiveMinimum": 0
        },
        "minWidth": {
          "type": "number",
          "exclusiveMinimum": 0
        },
        "minHeight": {
          "type": "number",
          "exclusiveMinimum": 0
        }
      }
    },
    "algorithmProvider": {
      "type": "boolean"
    },
    "algorithmCategories": {
      "type": "array",
      "uniqueItems": true,
      "items": {
        "type": "string",
        "pattern": "^[A-Za-z0-9][A-Za-z0-9._-]*$"
      }
    },
    "algorithmProvides": {
      "type": "array",
      "uniqueItems": true,
      "items": {
        "type": "object",
        "additionalProperties": false,
        "required": [
          "category",
          "id",
          "version"
        ],
        "properties": {
          "category": {
            "type": "string",
            "pattern": "^[A-Za-z0-9][A-Za-z0-9._-]*$"
          },
          "id": {
            "type": "string",
            "pattern": "^[A-Za-z0-9][A-Za-z0-9._-]*$"
          },
          "version": {
            "type": "string",
            "pattern": "^\\d+\\.\\d+\\.\\d+(?:-[0-9A-Za-z.-]+)?$"
          },
          "title": {
            "type": "string",
            "minLength": 1
          }
        }
      }
    },
    "compatibility": {
      "type": "object",
      "additionalProperties": false,
      "properties": {
        "app": {
          "type": "string",
          "minLength": 1
        },
        "pluginApi": {
          "type": "string",
          "minLength": 1
        }
      }
    },
    "pluginDependencies": {
      "type": "array",
      "uniqueItems": true,
      "items": {
        "type": "object",
        "additionalProperties": false,
        "required": [
          "id",
          "range"
        ],
        "properties": {
          "id": {
            "type": "string",
            "pattern": "^[A-Za-z0-9][A-Za-z0-9._-]*$"
          },
          "range": {
            "type": "string",
            "minLength": 1
          },
          "optional": {
            "type": "boolean"
          }
        }
      }
    },
    "scripts": {
      "type": "array",
      "minItems": 1,
      "uniqueItems": true,
      "items": {
        "type": "string",
        "pattern": "^[^/\\\\]+\\.js$"
      }
    },
    "styles": {
      "type": "array",
      "uniqueItems": true,
      "items": {
        "type": "string",
        "pattern": "^[^/\\\\]+\\.css$"
      }
    },
    "icon": {
      "type": "string",
      "minLength": 1
    },
    "data": {
      "type": "object",
      "properties": {
        "accepts": {
          "type": "array",
          "items": {
            "type": "string"
          }
        },
        "produces": {
          "type": "array",
          "items": {
            "type": "string"
          }
        }
      }
    }
  },
  "allOf": [
    {
      "if": {
        "properties": {
          "pluginType": {
            "const": "workbench"
          },
          "workspace": {
            "properties": {
              "role": {
                "const": "top"
              }
            },
            "required": [
              "role"
            ]
          }
        },
        "required": [
          "pluginType",
          "workspace"
        ]
      },
      "then": {
        "required": [
          "window"
        ],
        "properties": {
          "workspace": {
            "required": [
              "role",
              "activity"
            ]
          },
          "window": {
            "required": [
              "activity"
            ]
          }
        }
      }
    }
  ]
}
