{
  "id": "builtin.flexible-import",
  "name": "Flexible Text Import",
  "version": "1.1.0",
  "apiVersion": "1.13.0",
  "requiresCore": [
    "science",
    "data.importers",
    "data.model"
  ],
  "entry": "plugin.js",
  "enabled": true,
  "order": 10,
  "description": "Generic text/multicolumn import provider used by the import workbench.",
  "capabilities": [
    "data.importer",
    "data.inspector"
  ],
  "pluginType": "data",
  "pluginDependencies": [
    {
      "id": "builtin.scientific-data-contracts",
      "range": "^1.0.0"
    }
  ]
}
